{
 "format": 1,
 "id": "n_412_301",
 "kind": "code",
 "version": 1,
 "center": {
  "lat": 60.41,
  "lon": 24.62
 },
 "grid_north": -24.6,
 "habitat": "boreal_forest",
 "home": "boreal_forest",
 "seed": 2843117,
 "water": 0.18,
 "species": {
  "playable": [
   "fox",
   "moose",
   "mountain_hare"
  ],
  "prey": [
   "vole",
   "frog"
  ],
  "predators": [
   "fox"
  ]
 },
 "edges": {
  "n": [
   12,
   12,
   12,
   12,
   12,
   12,
   12,
   12,
   12,
   12,
   12,
   12,
   12,
   12,
   12,
   12,
   12,
   12,
   12,
   12,
   12,
   12,
   12,
   12,
   12,
   12,
   12,
   12,
   12,
   12,
   12,
   12,
   12,
   12,
   12,
   12,
   12,
   12,
   12,
   12,
   12,
   12,
   12,
   12,
   12,
   12,
   12,
   12,
   12,
   12,
   12,
   12,
   12,
   12,
   12,
   12,
   12,
   12,
   12,
   12,
   12,
   12,
   12,
   12,
   12
  ],
  "e": [
   12,
   12,
   12,
   12,
   12,
   12,
   12,
   12,
   12,
   12,
   12,
   12,
   12,
   12,
   12,
   12,
   12,
   12,
   12,
   12,
   12,
   12,
   12,
   12,
   12,
   12,
   12,
   12,
   12,
   12,
   12,
   12,
   12,
   12,
   12,
   12,
   12,
   12,
   12,
   12,
   12,
   12,
   12,
   12,
   12,
   12,
   12,
   12,
   12,
   12,
   12,
   12,
   12,
   12,
   12,
   12,
   12,
   12,
   12,
   12,
   12,
   12,
   12,
   12,
   12
  ],
  "s": [
   12,
   12,
   12,
   12,
   12,
   12,
   12,
   12,
   12,
   12,
   12,
   12,
   12,
   12,
   12,
   12,
   12,
   12,
   12,
   12,
   12,
   12,
   12,
   12,
   12,
   12,
   12,
   12,
   12,
   12,
   12,
   12,
   12,
   12,
   12,
   12,
   12,
   12,
   12,
   12,
   12,
   12,
   12,
   12,
   12,
   12,
   12,
   12,
   12,
   12,
   12,
   12,
   12,
   12,
   12,
   12,
   12,
   12,
   12,
   12,
   12,
   12,
   12,
   12,
   12
  ],
  "w": [
   12,
   12,
   12,
   12,
   12,
   12,
   12,
   12,
   12,
   12,
   12,
   12,
   12,
   12,
   12,
   12,
   12,
   12,
   12,
   12,
   12,
   12,
   12,
   12,
   12,
   12,
   12,
   12,
   12,
   12,
   12,
   12,
   12,
   12,
   12,
   12,
   12,
   12,
   12,
   12,
   12,
   12,
   12,
   12,
   12,
   12,
   12,
   12,
   12,
   12,
   12,
   12,
   12,
   12,
   12,
   12,
   12,
   12,
   12,
   12,
   12,
   12,
   12,
   12,
   12
  ]
 },
 "landmarks": [],
 "requires": {
  "homes": [
   "boreal_forest"
  ],
  "animals": [
   "fox",
   "moose",
   "mountain_hare",
   "vole",
   "frog"
  ]
 },
 "sources": {
  "habitat": "resolve2017:432",
  "water": "naturalearth:lakes:5.1.1",
  "species": "gbif:10.15468/dl.xxxxxx"
 },
 "made": {
  "by": "tile_maker",
  "maker": "0.4.0",
  "world": "c341d52",
  "at": "2026-11-01T10:00:00Z"
 },
 "ecoregion": 432,
 "level": 12,
 "height": 32,
 "coast": [
  "11111",
  "11110",
  "11000",
  "10000",
  "00000"
 ],
 "wanted": [
  {
   "kind": "animal",
   "what": "lynx",
   "part": "forest"
  },
  {
   "kind": "plant",
   "what": "cloudberry",
   "part": "bog"
  }
 ]
}
